{"insight":"The receiver is shaped before truth arrives","plainSummary":"A practice first teaches us what kind of truth we are able to notice and trust.","atAGlance":"Before a teaching gives answers, it trains attention. Each path makes certain signs feel trustworthy and others feel mistaken. Silence after practice is not empty in the same way for everyone. To compare paths fairly, ask what each one teaches a person to receive.","match":["receiver precedes"],"tags":["practice","attention","truth","comparison"]}