{"insight":"A path must answer to its ending","plainSummary":"A practice reveals its character by how it treats its own authority when the work is done.","atAGlance":"Every path must face its ending. Some trust the method that brought them there. Some let the method fall away. Some outgrow the need to defend it.","match":["method's reckoning"],"tags":["practice","authority","teaching"]}