{"insight":"Forgetting Needs a Living Flame","plainSummary":"Letting go can empty the self-story, but it still needs a living act of attention, love, or release.","atAGlance":"Letting go is not blankness. Something living must still attend, love, release, or respond. When practice tries to let go of that too, it reaches paradox. The deepest forgetting reveals the act it depends on.","match":["forgetting cannot forget"],"tags":["letting go","attention","practice"]}