{"insight":"A path is known by what interrupts it","plainSummary":"A path reveals itself by what it allows to disturb calm and call the seeker onward.","atAGlance":"Quiet is not the end of seeing. Different paths let different things break that quiet: pain, change, duty, love, or the one who sees refusing to become an object. The real test is what can correct a settled mind. Love becomes a way knowledge calls us, not something we merely inspect.","match":["interruption gate"],"tags":["attention","love","practice","clarity"]}