{"insight":"Freed attention seeks its home","plainSummary":"When old stories loosen, attention must learn where to rest.","atAGlance":"When we loosen our grip on sights, sounds, and stories, a quiet question appears. Does attention belong to no one, to the hidden self, or to God? Each path is known by where it teaches freed attention to rest.","match":["unclaimed attention"],"tags":["attention","practice","self","surrender"]}