{"insight":"The eye cannot stand outside seeing","plainSummary":"When we study awareness, the seeker and the sought cannot fully separate, so different paths keep meeting the same limits.","atAGlance":"The harder we look at awareness, the more the looking becomes part of what is being seen. Philosophy and inner practice both reach this knot in different languages. Their answers repeat a small set of moves: reduce it, protect it, dissolve it, spread it, confess mystery, or make it relational. One missing move is love, where knowing comes by joining rather than standing apart.","match":["same wall"],"tags":["awareness","inquiry","practice","love"]}