{"insight":"Gift Still Needs a Place to Land","plainSummary":"Every path must place the burden of practice somewhere: in doing, receiving, remembering, recognizing, or being carried by others.","atAGlance":"The question is not whether awakening comes by effort or gift. Every path still needs a way to receive, remember, act, notice, and become whole. Some paths ask us to strive, while others ask us to trust what is given. Trouble comes when the needed strength is missing, swollen, or placed in the wrong hands.","match":["capacity ledger"],"tags":["practice","gift","effort","trust"]}