{"insight":"Effort must serve, not steal","plainSummary":"The right effort helps prepare the heart without claiming the gift as its own.","atAGlance":"How do I work hard without turning insight into a prize? Each path gives effort a boundary. It teaches what to do, what to refuse, and where to stop. When effort forgets its limit, help becomes ownership.","match":["effort envelope"],"tags":["effort","practice","insight","humility"]}