{"insight":"Every letting go needs someone to let go","plainSummary":"A path can loosen the self only because someone can listen, remember, practice, and notice what changes.","atAGlance":"A path may teach us to release the self, but it still needs someone who can practice. Someone must hear the words, return each day, remember the lesson, and recognize the change. The deeper question is how a teaching honors the one who walks while pointing beyond that one.","match":["teaching dissolves"],"tags":["practice","self","attention"]}